concept,template_id,template,text
love,0,This is about {concept}.,This is about love.
love,1,The concept of {concept} is important.,The concept of love is important.
love,2,{concept} represents a fundamental idea.,love represents a fundamental idea.
love,3,Understanding {concept} requires careful thought.,Understanding love requires careful thought.
love,4,Many people think about {concept} differently.,Many people think about love differently.
love,5,The meaning of {concept} can vary across cultures.,The meaning of love can vary across cultures.
happiness,0,This is about {concept}.,This is about happiness.
happiness,1,The concept of {concept} is important.,The concept of happiness is important.
happiness,2,{concept} represents a fundamental idea.,happiness represents a fundamental idea.
happiness,3,Understanding {concept} requires careful thought.,Understanding happiness requires careful thought.
happiness,4,Many people think about {concept} differently.,Many people think about happiness differently.
happiness,5,The meaning of {concept} can vary across cultures.,The meaning of happiness can vary across cultures.
freedom,0,This is about {concept}.,This is about freedom.
freedom,1,The concept of {concept} is important.,The concept of freedom is important.
freedom,2,{concept} represents a fundamental idea.,freedom represents a fundamental idea.
freedom,3,Understanding {concept} requires careful thought.,Understanding freedom requires careful thought.
freedom,4,Many people think about {concept} differently.,Many people think about freedom differently.
freedom,5,The meaning of {concept} can vary across cultures.,The meaning of freedom can vary across cultures.
justice,0,This is about {concept}.,This is about justice.
justice,1,The concept of {concept} is important.,The concept of justice is important.
justice,2,{concept} represents a fundamental idea.,justice represents a fundamental idea.
justice,3,Understanding {concept} requires careful thought.,Understanding justice requires careful thought.
justice,4,Many people think about {concept} differently.,Many people think about justice differently.
justice,5,The meaning of {concept} can vary across cultures.,The meaning of justice can vary across cultures.
truth,0,This is about {concept}.,This is about truth.
truth,1,The concept of {concept} is important.,The concept of truth is important.
truth,2,{concept} represents a fundamental idea.,truth represents a fundamental idea.
truth,3,Understanding {concept} requires careful thought.,Understanding truth requires careful thought.
truth,4,Many people think about {concept} differently.,Many people think about truth differently.
truth,5,The meaning of {concept} can vary across cultures.,The meaning of truth can vary across cultures.
beauty,0,This is about {concept}.,This is about beauty.
beauty,1,The concept of {concept} is important.,The concept of beauty is important.
beauty,2,{concept} represents a fundamental idea.,beauty represents a fundamental idea.
beauty,3,Understanding {concept} requires careful thought.,Understanding beauty requires careful thought.
beauty,4,Many people think about {concept} differently.,Many people think about beauty differently.
beauty,5,The meaning of {concept} can vary across cultures.,The meaning of beauty can vary across cultures.
wisdom,0,This is about {concept}.,This is about wisdom.
wisdom,1,The concept of {concept} is important.,The concept of wisdom is important.
wisdom,2,{concept} represents a fundamental idea.,wisdom represents a fundamental idea.
wisdom,3,Understanding {concept} requires careful thought.,Understanding wisdom requires careful thought.
wisdom,4,Many people think about {concept} differently.,Many people think about wisdom differently.
wisdom,5,The meaning of {concept} can vary across cultures.,The meaning of wisdom can vary across cultures.
courage,0,This is about {concept}.,This is about courage.
courage,1,The concept of {concept} is important.,The concept of courage is important.
courage,2,{concept} represents a fundamental idea.,courage represents a fundamental idea.
courage,3,Understanding {concept} requires careful thought.,Understanding courage requires careful thought.
courage,4,Many people think about {concept} differently.,Many people think about courage differently.
courage,5,The meaning of {concept} can vary across cultures.,The meaning of courage can vary across cultures.
knowledge,0,This is about {concept}.,This is about knowledge.
knowledge,1,The concept of {concept} is important.,The concept of knowledge is important.
knowledge,2,{concept} represents a fundamental idea.,knowledge represents a fundamental idea.
knowledge,3,Understanding {concept} requires careful thought.,Understanding knowledge requires careful thought.
knowledge,4,Many people think about {concept} differently.,Many people think about knowledge differently.
knowledge,5,The meaning of {concept} can vary across cultures.,The meaning of knowledge can vary across cultures.
peace,0,This is about {concept}.,This is about peace.
peace,1,The concept of {concept} is important.,The concept of peace is important.
peace,2,{concept} represents a fundamental idea.,peace represents a fundamental idea.
peace,3,Understanding {concept} requires careful thought.,Understanding peace requires careful thought.
peace,4,Many people think about {concept} differently.,Many people think about peace differently.
peace,5,The meaning of {concept} can vary across cultures.,The meaning of peace can vary across cultures.
hope,0,This is about {concept}.,This is about hope.
hope,1,The concept of {concept} is important.,The concept of hope is important.
hope,2,{concept} represents a fundamental idea.,hope represents a fundamental idea.
hope,3,Understanding {concept} requires careful thought.,Understanding hope requires careful thought.
hope,4,Many people think about {concept} differently.,Many people think about hope differently.
hope,5,The meaning of {concept} can vary across cultures.,The meaning of hope can vary across cultures.
faith,0,This is about {concept}.,This is about faith.
faith,1,The concept of {concept} is important.,The concept of faith is important.
faith,2,{concept} represents a fundamental idea.,faith represents a fundamental idea.
faith,3,Understanding {concept} requires careful thought.,Understanding faith requires careful thought.
faith,4,Many people think about {concept} differently.,Many people think about faith differently.
faith,5,The meaning of {concept} can vary across cultures.,The meaning of faith can vary across cultures.
trust,0,This is about {concept}.,This is about trust.
trust,1,The concept of {concept} is important.,The concept of trust is important.
trust,2,{concept} represents a fundamental idea.,trust represents a fundamental idea.
trust,3,Understanding {concept} requires careful thought.,Understanding trust requires careful thought.
trust,4,Many people think about {concept} differently.,Many people think about trust differently.
trust,5,The meaning of {concept} can vary across cultures.,The meaning of trust can vary across cultures.
loyalty,0,This is about {concept}.,This is about loyalty.
loyalty,1,The concept of {concept} is important.,The concept of loyalty is important.
loyalty,2,{concept} represents a fundamental idea.,loyalty represents a fundamental idea.
loyalty,3,Understanding {concept} requires careful thought.,Understanding loyalty requires careful thought.
loyalty,4,Many people think about {concept} differently.,Many people think about loyalty differently.
loyalty,5,The meaning of {concept} can vary across cultures.,The meaning of loyalty can vary across cultures.
honesty,0,This is about {concept}.,This is about honesty.
honesty,1,The concept of {concept} is important.,The concept of honesty is important.
honesty,2,{concept} represents a fundamental idea.,honesty represents a fundamental idea.
honesty,3,Understanding {concept} requires careful thought.,Understanding honesty requires careful thought.
honesty,4,Many people think about {concept} differently.,Many people think about honesty differently.
honesty,5,The meaning of {concept} can vary across cultures.,The meaning of honesty can vary across cultures.
integrity,0,This is about {concept}.,This is about integrity.
integrity,1,The concept of {concept} is important.,The concept of integrity is important.
integrity,2,{concept} represents a fundamental idea.,integrity represents a fundamental idea.
integrity,3,Understanding {concept} requires careful thought.,Understanding integrity requires careful thought.
integrity,4,Many people think about {concept} differently.,Many people think about integrity differently.
integrity,5,The meaning of {concept} can vary across cultures.,The meaning of integrity can vary across cultures.
joy,0,This is about {concept}.,This is about joy.
joy,1,The concept of {concept} is important.,The concept of joy is important.
joy,2,{concept} represents a fundamental idea.,joy represents a fundamental idea.
joy,3,Understanding {concept} requires careful thought.,Understanding joy requires careful thought.
joy,4,Many people think about {concept} differently.,Many people think about joy differently.
joy,5,The meaning of {concept} can vary across cultures.,The meaning of joy can vary across cultures.
sadness,0,This is about {concept}.,This is about sadness.
sadness,1,The concept of {concept} is important.,The concept of sadness is important.
sadness,2,{concept} represents a fundamental idea.,sadness represents a fundamental idea.
sadness,3,Understanding {concept} requires careful thought.,Understanding sadness requires careful thought.
sadness,4,Many people think about {concept} differently.,Many people think about sadness differently.
sadness,5,The meaning of {concept} can vary across cultures.,The meaning of sadness can vary across cultures.
anger,0,This is about {concept}.,This is about anger.
anger,1,The concept of {concept} is important.,The concept of anger is important.
anger,2,{concept} represents a fundamental idea.,anger represents a fundamental idea.
anger,3,Understanding {concept} requires careful thought.,Understanding anger requires careful thought.
anger,4,Many people think about {concept} differently.,Many people think about anger differently.
anger,5,The meaning of {concept} can vary across cultures.,The meaning of anger can vary across cultures.
fear,0,This is about {concept}.,This is about fear.
fear,1,The concept of {concept} is important.,The concept of fear is important.
fear,2,{concept} represents a fundamental idea.,fear represents a fundamental idea.
fear,3,Understanding {concept} requires careful thought.,Understanding fear requires careful thought.
fear,4,Many people think about {concept} differently.,Many people think about fear differently.
fear,5,The meaning of {concept} can vary across cultures.,The meaning of fear can vary across cultures.
surprise,0,This is about {concept}.,This is about surprise.
surprise,1,The concept of {concept} is important.,The concept of surprise is important.
surprise,2,{concept} represents a fundamental idea.,surprise represents a fundamental idea.
surprise,3,Understanding {concept} requires careful thought.,Understanding surprise requires careful thought.
surprise,4,Many people think about {concept} differently.,Many people think about surprise differently.
surprise,5,The meaning of {concept} can vary across cultures.,The meaning of surprise can vary across cultures.
disgust,0,This is about {concept}.,This is about disgust.
disgust,1,The concept of {concept} is important.,The concept of disgust is important.
disgust,2,{concept} represents a fundamental idea.,disgust represents a fundamental idea.
disgust,3,Understanding {concept} requires careful thought.,Understanding disgust requires careful thought.
disgust,4,Many people think about {concept} differently.,Many people think about disgust differently.
disgust,5,The meaning of {concept} can vary across cultures.,The meaning of disgust can vary across cultures.
anticipation,0,This is about {concept}.,This is about anticipation.
anticipation,1,The concept of {concept} is important.,The concept of anticipation is important.
anticipation,2,{concept} represents a fundamental idea.,anticipation represents a fundamental idea.
anticipation,3,Understanding {concept} requires careful thought.,Understanding anticipation requires careful thought.
anticipation,4,Many people think about {concept} differently.,Many people think about anticipation differently.
anticipation,5,The meaning of {concept} can vary across cultures.,The meaning of anticipation can vary across cultures.
acceptance,0,This is about {concept}.,This is about acceptance.
acceptance,1,The concept of {concept} is important.,The concept of acceptance is important.
acceptance,2,{concept} represents a fundamental idea.,acceptance represents a fundamental idea.
acceptance,3,Understanding {concept} requires careful thought.,Understanding acceptance requires careful thought.
acceptance,4,Many people think about {concept} differently.,Many people think about acceptance differently.
acceptance,5,The meaning of {concept} can vary across cultures.,The meaning of acceptance can vary across cultures.
excitement,0,This is about {concept}.,This is about excitement.
excitement,1,The concept of {concept} is important.,The concept of excitement is important.
excitement,2,{concept} represents a fundamental idea.,excitement represents a fundamental idea.
excitement,3,Understanding {concept} requires careful thought.,Understanding excitement requires careful thought.
excitement,4,Many people think about {concept} differently.,Many people think about excitement differently.
excitement,5,The meaning of {concept} can vary across cultures.,The meaning of excitement can vary across cultures.
anxiety,0,This is about {concept}.,This is about anxiety.
anxiety,1,The concept of {concept} is important.,The concept of anxiety is important.
anxiety,2,{concept} represents a fundamental idea.,anxiety represents a fundamental idea.
anxiety,3,Understanding {concept} requires careful thought.,Understanding anxiety requires careful thought.
anxiety,4,Many people think about {concept} differently.,Many people think about anxiety differently.
anxiety,5,The meaning of {concept} can vary across cultures.,The meaning of anxiety can vary across cultures.
calm,0,This is about {concept}.,This is about calm.
calm,1,The concept of {concept} is important.,The concept of calm is important.
calm,2,{concept} represents a fundamental idea.,calm represents a fundamental idea.
calm,3,Understanding {concept} requires careful thought.,Understanding calm requires careful thought.
calm,4,Many people think about {concept} differently.,Many people think about calm differently.
calm,5,The meaning of {concept} can vary across cultures.,The meaning of calm can vary across cultures.
stress,0,This is about {concept}.,This is about stress.
stress,1,The concept of {concept} is important.,The concept of stress is important.
stress,2,{concept} represents a fundamental idea.,stress represents a fundamental idea.
stress,3,Understanding {concept} requires careful thought.,Understanding stress requires careful thought.
stress,4,Many people think about {concept} differently.,Many people think about stress differently.
stress,5,The meaning of {concept} can vary across cultures.,The meaning of stress can vary across cultures.
relief,0,This is about {concept}.,This is about relief.
relief,1,The concept of {concept} is important.,The concept of relief is important.
relief,2,{concept} represents a fundamental idea.,relief represents a fundamental idea.
relief,3,Understanding {concept} requires careful thought.,Understanding relief requires careful thought.
relief,4,Many people think about {concept} differently.,Many people think about relief differently.
relief,5,The meaning of {concept} can vary across cultures.,The meaning of relief can vary across cultures.
pride,0,This is about {concept}.,This is about pride.
pride,1,The concept of {concept} is important.,The concept of pride is important.
pride,2,{concept} represents a fundamental idea.,pride represents a fundamental idea.
pride,3,Understanding {concept} requires careful thought.,Understanding pride requires careful thought.
pride,4,Many people think about {concept} differently.,Many people think about pride differently.
pride,5,The meaning of {concept} can vary across cultures.,The meaning of pride can vary across cultures.
shame,0,This is about {concept}.,This is about shame.
shame,1,The concept of {concept} is important.,The concept of shame is important.
shame,2,{concept} represents a fundamental idea.,shame represents a fundamental idea.
shame,3,Understanding {concept} requires careful thought.,Understanding shame requires careful thought.
shame,4,Many people think about {concept} differently.,Many people think about shame differently.
shame,5,The meaning of {concept} can vary across cultures.,The meaning of shame can vary across cultures.
guilt,0,This is about {concept}.,This is about guilt.
guilt,1,The concept of {concept} is important.,The concept of guilt is important.
guilt,2,{concept} represents a fundamental idea.,guilt represents a fundamental idea.
guilt,3,Understanding {concept} requires careful thought.,Understanding guilt requires careful thought.
guilt,4,Many people think about {concept} differently.,Many people think about guilt differently.
guilt,5,The meaning of {concept} can vary across cultures.,The meaning of guilt can vary across cultures.
mountain,0,This is about {concept}.,This is about mountain.
mountain,1,The concept of {concept} is important.,The concept of mountain is important.
mountain,2,{concept} represents a fundamental idea.,mountain represents a fundamental idea.
mountain,3,Understanding {concept} requires careful thought.,Understanding mountain requires careful thought.
mountain,4,Many people think about {concept} differently.,Many people think about mountain differently.
mountain,5,The meaning of {concept} can vary across cultures.,The meaning of mountain can vary across cultures.
river,0,This is about {concept}.,This is about river.
river,1,The concept of {concept} is important.,The concept of river is important.
river,2,{concept} represents a fundamental idea.,river represents a fundamental idea.
river,3,Understanding {concept} requires careful thought.,Understanding river requires careful thought.
river,4,Many people think about {concept} differently.,Many people think about river differently.
river,5,The meaning of {concept} can vary across cultures.,The meaning of river can vary across cultures.
ocean,0,This is about {concept}.,This is about ocean.
ocean,1,The concept of {concept} is important.,The concept of ocean is important.
ocean,2,{concept} represents a fundamental idea.,ocean represents a fundamental idea.
ocean,3,Understanding {concept} requires careful thought.,Understanding ocean requires careful thought.
ocean,4,Many people think about {concept} differently.,Many people think about ocean differently.
ocean,5,The meaning of {concept} can vary across cultures.,The meaning of ocean can vary across cultures.
forest,0,This is about {concept}.,This is about forest.
forest,1,The concept of {concept} is important.,The concept of forest is important.
forest,2,{concept} represents a fundamental idea.,forest represents a fundamental idea.
forest,3,Understanding {concept} requires careful thought.,Understanding forest requires careful thought.
forest,4,Many people think about {concept} differently.,Many people think about forest differently.
forest,5,The meaning of {concept} can vary across cultures.,The meaning of forest can vary across cultures.
desert,0,This is about {concept}.,This is about desert.
desert,1,The concept of {concept} is important.,The concept of desert is important.
desert,2,{concept} represents a fundamental idea.,desert represents a fundamental idea.
desert,3,Understanding {concept} requires careful thought.,Understanding desert requires careful thought.
desert,4,Many people think about {concept} differently.,Many people think about desert differently.
desert,5,The meaning of {concept} can vary across cultures.,The meaning of desert can vary across cultures.
sky,0,This is about {concept}.,This is about sky.
sky,1,The concept of {concept} is important.,The concept of sky is important.
sky,2,{concept} represents a fundamental idea.,sky represents a fundamental idea.
sky,3,Understanding {concept} requires careful thought.,Understanding sky requires careful thought.
sky,4,Many people think about {concept} differently.,Many people think about sky differently.
sky,5,The meaning of {concept} can vary across cultures.,The meaning of sky can vary across cultures.
sun,0,This is about {concept}.,This is about sun.
sun,1,The concept of {concept} is important.,The concept of sun is important.
sun,2,{concept} represents a fundamental idea.,sun represents a fundamental idea.
sun,3,Understanding {concept} requires careful thought.,Understanding sun requires careful thought.
sun,4,Many people think about {concept} differently.,Many people think about sun differently.
sun,5,The meaning of {concept} can vary across cultures.,The meaning of sun can vary across cultures.
moon,0,This is about {concept}.,This is about moon.
moon,1,The concept of {concept} is important.,The concept of moon is important.
moon,2,{concept} represents a fundamental idea.,moon represents a fundamental idea.
moon,3,Understanding {concept} requires careful thought.,Understanding moon requires careful thought.
moon,4,Many people think about {concept} differently.,Many people think about moon differently.
moon,5,The meaning of {concept} can vary across cultures.,The meaning of moon can vary across cultures.
star,0,This is about {concept}.,This is about star.
star,1,The concept of {concept} is important.,The concept of star is important.
star,2,{concept} represents a fundamental idea.,star represents a fundamental idea.
star,3,Understanding {concept} requires careful thought.,Understanding star requires careful thought.
star,4,Many people think about {concept} differently.,Many people think about star differently.
star,5,The meaning of {concept} can vary across cultures.,The meaning of star can vary across cultures.
cloud,0,This is about {concept}.,This is about cloud.
cloud,1,The concept of {concept} is important.,The concept of cloud is important.
cloud,2,{concept} represents a fundamental idea.,cloud represents a fundamental idea.
cloud,3,Understanding {concept} requires careful thought.,Understanding cloud requires careful thought.
cloud,4,Many people think about {concept} differently.,Many people think about cloud differently.
cloud,5,The meaning of {concept} can vary across cultures.,The meaning of cloud can vary across cultures.
rain,0,This is about {concept}.,This is about rain.
rain,1,The concept of {concept} is important.,The concept of rain is important.
rain,2,{concept} represents a fundamental idea.,rain represents a fundamental idea.
rain,3,Understanding {concept} requires careful thought.,Understanding rain requires careful thought.
rain,4,Many people think about {concept} differently.,Many people think about rain differently.
rain,5,The meaning of {concept} can vary across cultures.,The meaning of rain can vary across cultures.
snow,0,This is about {concept}.,This is about snow.
snow,1,The concept of {concept} is important.,The concept of snow is important.
snow,2,{concept} represents a fundamental idea.,snow represents a fundamental idea.
snow,3,Understanding {concept} requires careful thought.,Understanding snow requires careful thought.
snow,4,Many people think about {concept} differently.,Many people think about snow differently.
snow,5,The meaning of {concept} can vary across cultures.,The meaning of snow can vary across cultures.
wind,0,This is about {concept}.,This is about wind.
wind,1,The concept of {concept} is important.,The concept of wind is important.
wind,2,{concept} represents a fundamental idea.,wind represents a fundamental idea.
wind,3,Understanding {concept} requires careful thought.,Understanding wind requires careful thought.
wind,4,Many people think about {concept} differently.,Many people think about wind differently.
wind,5,The meaning of {concept} can vary across cultures.,The meaning of wind can vary across cultures.
fire,0,This is about {concept}.,This is about fire.
fire,1,The concept of {concept} is important.,The concept of fire is important.
fire,2,{concept} represents a fundamental idea.,fire represents a fundamental idea.
fire,3,Understanding {concept} requires careful thought.,Understanding fire requires careful thought.
fire,4,Many people think about {concept} differently.,Many people think about fire differently.
fire,5,The meaning of {concept} can vary across cultures.,The meaning of fire can vary across cultures.
earth,0,This is about {concept}.,This is about earth.
earth,1,The concept of {concept} is important.,The concept of earth is important.
earth,2,{concept} represents a fundamental idea.,earth represents a fundamental idea.
earth,3,Understanding {concept} requires careful thought.,Understanding earth requires careful thought.
earth,4,Many people think about {concept} differently.,Many people think about earth differently.
earth,5,The meaning of {concept} can vary across cultures.,The meaning of earth can vary across cultures.
water,0,This is about {concept}.,This is about water.
water,1,The concept of {concept} is important.,The concept of water is important.
water,2,{concept} represents a fundamental idea.,water represents a fundamental idea.
water,3,Understanding {concept} requires careful thought.,Understanding water requires careful thought.
water,4,Many people think about {concept} differently.,Many people think about water differently.
water,5,The meaning of {concept} can vary across cultures.,The meaning of water can vary across cultures.
