concept,template_id,template,text
walking,1,The concept of {concept} is important.,The concept of walking is important.
walking,2,{concept} represents a fundamental idea.,walking represents a fundamental idea.
walking,3,Understanding {concept} requires careful thought.,Understanding walking requires careful thought.
walking,4,Many people think about {concept} differently.,Many people think about walking differently.
walking,5,The meaning of {concept} can vary across cultures.,The meaning of walking can vary across cultures.
jumping,0,This is about {concept}.,This is about jumping.
jumping,1,The concept of {concept} is important.,The concept of jumping is important.
jumping,2,{concept} represents a fundamental idea.,jumping represents a fundamental idea.
jumping,3,Understanding {concept} requires careful thought.,Understanding jumping requires careful thought.
jumping,4,Many people think about {concept} differently.,Many people think about jumping differently.
jumping,5,The meaning of {concept} can vary across cultures.,The meaning of jumping can vary across cultures.
swimming,0,This is about {concept}.,This is about swimming.
swimming,1,The concept of {concept} is important.,The concept of swimming is important.
swimming,2,{concept} represents a fundamental idea.,swimming represents a fundamental idea.
swimming,3,Understanding {concept} requires careful thought.,Understanding swimming requires careful thought.
swimming,4,Many people think about {concept} differently.,Many people think about swimming differently.
swimming,5,The meaning of {concept} can vary across cultures.,The meaning of swimming can vary across cultures.
flying,0,This is about {concept}.,This is about flying.
flying,1,The concept of {concept} is important.,The concept of flying is important.
flying,2,{concept} represents a fundamental idea.,flying represents a fundamental idea.
flying,3,Understanding {concept} requires careful thought.,Understanding flying requires careful thought.
flying,4,Many people think about {concept} differently.,Many people think about flying differently.
flying,5,The meaning of {concept} can vary across cultures.,The meaning of flying can vary across cultures.
climbing,0,This is about {concept}.,This is about climbing.
climbing,1,The concept of {concept} is important.,The concept of climbing is important.
climbing,2,{concept} represents a fundamental idea.,climbing represents a fundamental idea.
climbing,3,Understanding {concept} requires careful thought.,Understanding climbing requires careful thought.
climbing,4,Many people think about {concept} differently.,Many people think about climbing differently.
climbing,5,The meaning of {concept} can vary across cultures.,The meaning of climbing can vary across cultures.
