concept,template_id,template,text
dog,0,This is about {concept}.,This is about dog.
dog,1,The concept of {concept} is important.,The concept of dog is important.
dog,2,{concept} represents a fundamental idea.,dog represents a fundamental idea.
dog,3,Understanding {concept} requires careful thought.,Understanding dog requires careful thought.
dog,4,Many people think about {concept} differently.,Many people think about dog differently.
dog,5,The meaning of {concept} can vary across cultures.,The meaning of dog can vary across cultures.
cat,0,This is about {concept}.,This is about cat.
cat,1,The concept of {concept} is important.,The concept of cat is important.
cat,2,{concept} represents a fundamental idea.,cat represents a fundamental idea.
cat,3,Understanding {concept} requires careful thought.,Understanding cat requires careful thought.
cat,4,Many people think about {concept} differently.,Many people think about cat differently.
cat,5,The meaning of {concept} can vary across cultures.,The meaning of cat can vary across cultures.
bird,0,This is about {concept}.,This is about bird.
bird,1,The concept of {concept} is important.,The concept of bird is important.
bird,2,{concept} represents a fundamental idea.,bird represents a fundamental idea.
bird,3,Understanding {concept} requires careful thought.,Understanding bird requires careful thought.
bird,4,Many people think about {concept} differently.,Many people think about bird differently.
bird,5,The meaning of {concept} can vary across cultures.,The meaning of bird can vary across cultures.
fish,0,This is about {concept}.,This is about fish.
fish,1,The concept of {concept} is important.,The concept of fish is important.
fish,2,{concept} represents a fundamental idea.,fish represents a fundamental idea.
fish,3,Understanding {concept} requires careful thought.,Understanding fish requires careful thought.
fish,4,Many people think about {concept} differently.,Many people think about fish differently.
fish,5,The meaning of {concept} can vary across cultures.,The meaning of fish can vary across cultures.
elephant,0,This is about {concept}.,This is about elephant.
elephant,1,The concept of {concept} is important.,The concept of elephant is important.
elephant,2,{concept} represents a fundamental idea.,elephant represents a fundamental idea.
elephant,3,Understanding {concept} requires careful thought.,Understanding elephant requires careful thought.
elephant,4,Many people think about {concept} differently.,Many people think about elephant differently.
elephant,5,The meaning of {concept} can vary across cultures.,The meaning of elephant can vary across cultures.
lion,0,This is about {concept}.,This is about lion.
lion,1,The concept of {concept} is important.,The concept of lion is important.
lion,2,{concept} represents a fundamental idea.,lion represents a fundamental idea.
lion,3,Understanding {concept} requires careful thought.,Understanding lion requires careful thought.
lion,4,Many people think about {concept} differently.,Many people think about lion differently.
lion,5,The meaning of {concept} can vary across cultures.,The meaning of lion can vary across cultures.
tiger,0,This is about {concept}.,This is about tiger.
tiger,1,The concept of {concept} is important.,The concept of tiger is important.
tiger,2,{concept} represents a fundamental idea.,tiger represents a fundamental idea.
tiger,3,Understanding {concept} requires careful thought.,Understanding tiger requires careful thought.
tiger,4,Many people think about {concept} differently.,Many people think about tiger differently.
tiger,5,The meaning of {concept} can vary across cultures.,The meaning of tiger can vary across cultures.
bear,0,This is about {concept}.,This is about bear.
bear,1,The concept of {concept} is important.,The concept of bear is important.
bear,2,{concept} represents a fundamental idea.,bear represents a fundamental idea.
bear,3,Understanding {concept} requires careful thought.,Understanding bear requires careful thought.
bear,4,Many people think about {concept} differently.,Many people think about bear differently.
bear,5,The meaning of {concept} can vary across cultures.,The meaning of bear can vary across cultures.
horse,0,This is about {concept}.,This is about horse.
horse,1,The concept of {concept} is important.,The concept of horse is important.
horse,2,{concept} represents a fundamental idea.,horse represents a fundamental idea.
horse,3,Understanding {concept} requires careful thought.,Understanding horse requires careful thought.
horse,4,Many people think about {concept} differently.,Many people think about horse differently.
horse,5,The meaning of {concept} can vary across cultures.,The meaning of horse can vary across cultures.
cow,0,This is about {concept}.,This is about cow.
cow,1,The concept of {concept} is important.,The concept of cow is important.
cow,2,{concept} represents a fundamental idea.,cow represents a fundamental idea.
cow,3,Understanding {concept} requires careful thought.,Understanding cow requires careful thought.
cow,4,Many people think about {concept} differently.,Many people think about cow differently.
cow,5,The meaning of {concept} can vary across cultures.,The meaning of cow can vary across cultures.
sheep,0,This is about {concept}.,This is about sheep.
sheep,1,The concept of {concept} is important.,The concept of sheep is important.
sheep,2,{concept} represents a fundamental idea.,sheep represents a fundamental idea.
sheep,3,Understanding {concept} requires careful thought.,Understanding sheep requires careful thought.
sheep,4,Many people think about {concept} differently.,Many people think about sheep differently.
sheep,5,The meaning of {concept} can vary across cultures.,The meaning of sheep can vary across cultures.
pig,0,This is about {concept}.,This is about pig.
pig,1,The concept of {concept} is important.,The concept of pig is important.
pig,2,{concept} represents a fundamental idea.,pig represents a fundamental idea.
pig,3,Understanding {concept} requires careful thought.,Understanding pig requires careful thought.
pig,4,Many people think about {concept} differently.,Many people think about pig differently.
pig,5,The meaning of {concept} can vary across cultures.,The meaning of pig can vary across cultures.
chicken,0,This is about {concept}.,This is about chicken.
chicken,1,The concept of {concept} is important.,The concept of chicken is important.
chicken,2,{concept} represents a fundamental idea.,chicken represents a fundamental idea.
chicken,3,Understanding {concept} requires careful thought.,Understanding chicken requires careful thought.
chicken,4,Many people think about {concept} differently.,Many people think about chicken differently.
chicken,5,The meaning of {concept} can vary across cultures.,The meaning of chicken can vary across cultures.
duck,0,This is about {concept}.,This is about duck.
duck,1,The concept of {concept} is important.,The concept of duck is important.
duck,2,{concept} represents a fundamental idea.,duck represents a fundamental idea.
duck,3,Understanding {concept} requires careful thought.,Understanding duck requires careful thought.
duck,4,Many people think about {concept} differently.,Many people think about duck differently.
duck,5,The meaning of {concept} can vary across cultures.,The meaning of duck can vary across cultures.
rabbit,0,This is about {concept}.,This is about rabbit.
rabbit,1,The concept of {concept} is important.,The concept of rabbit is important.
rabbit,2,{concept} represents a fundamental idea.,rabbit represents a fundamental idea.
rabbit,3,Understanding {concept} requires careful thought.,Understanding rabbit requires careful thought.
rabbit,4,Many people think about {concept} differently.,Many people think about rabbit differently.
rabbit,5,The meaning of {concept} can vary across cultures.,The meaning of rabbit can vary across cultures.
mouse,0,This is about {concept}.,This is about mouse.
mouse,1,The concept of {concept} is important.,The concept of mouse is important.
mouse,2,{concept} represents a fundamental idea.,mouse represents a fundamental idea.
mouse,3,Understanding {concept} requires careful thought.,Understanding mouse requires careful thought.
mouse,4,Many people think about {concept} differently.,Many people think about mouse differently.
mouse,5,The meaning of {concept} can vary across cultures.,The meaning of mouse can vary across cultures.
tree,0,This is about {concept}.,This is about tree.
tree,1,The concept of {concept} is important.,The concept of tree is important.
tree,2,{concept} represents a fundamental idea.,tree represents a fundamental idea.
tree,3,Understanding {concept} requires careful thought.,Understanding tree requires careful thought.
tree,4,Many people think about {concept} differently.,Many people think about tree differently.
tree,5,The meaning of {concept} can vary across cultures.,The meaning of tree can vary across cultures.
flower,0,This is about {concept}.,This is about flower.
flower,1,The concept of {concept} is important.,The concept of flower is important.
flower,2,{concept} represents a fundamental idea.,flower represents a fundamental idea.
flower,3,Understanding {concept} requires careful thought.,Understanding flower requires careful thought.
flower,4,Many people think about {concept} differently.,Many people think about flower differently.
flower,5,The meaning of {concept} can vary across cultures.,The meaning of flower can vary across cultures.
grass,0,This is about {concept}.,This is about grass.
grass,1,The concept of {concept} is important.,The concept of grass is important.
grass,2,{concept} represents a fundamental idea.,grass represents a fundamental idea.
grass,3,Understanding {concept} requires careful thought.,Understanding grass requires careful thought.
grass,4,Many people think about {concept} differently.,Many people think about grass differently.
grass,5,The meaning of {concept} can vary across cultures.,The meaning of grass can vary across cultures.
rose,0,This is about {concept}.,This is about rose.
rose,1,The concept of {concept} is important.,The concept of rose is important.
rose,2,{concept} represents a fundamental idea.,rose represents a fundamental idea.
rose,3,Understanding {concept} requires careful thought.,Understanding rose requires careful thought.
rose,4,Many people think about {concept} differently.,Many people think about rose differently.
rose,5,The meaning of {concept} can vary across cultures.,The meaning of rose can vary across cultures.
lily,0,This is about {concept}.,This is about lily.
lily,1,The concept of {concept} is important.,The concept of lily is important.
lily,2,{concept} represents a fundamental idea.,lily represents a fundamental idea.
lily,3,Understanding {concept} requires careful thought.,Understanding lily requires careful thought.
lily,4,Many people think about {concept} differently.,Many people think about lily differently.
lily,5,The meaning of {concept} can vary across cultures.,The meaning of lily can vary across cultures.
orchid,0,This is about {concept}.,This is about orchid.
orchid,1,The concept of {concept} is important.,The concept of orchid is important.
orchid,2,{concept} represents a fundamental idea.,orchid represents a fundamental idea.
orchid,3,Understanding {concept} requires careful thought.,Understanding orchid requires careful thought.
orchid,4,Many people think about {concept} differently.,Many people think about orchid differently.
orchid,5,The meaning of {concept} can vary across cultures.,The meaning of orchid can vary across cultures.
cactus,0,This is about {concept}.,This is about cactus.
cactus,1,The concept of {concept} is important.,The concept of cactus is important.
cactus,2,{concept} represents a fundamental idea.,cactus represents a fundamental idea.
cactus,3,Understanding {concept} requires careful thought.,Understanding cactus requires careful thought.
cactus,4,Many people think about {concept} differently.,Many people think about cactus differently.
cactus,5,The meaning of {concept} can vary across cultures.,The meaning of cactus can vary across cultures.
fern,0,This is about {concept}.,This is about fern.
fern,1,The concept of {concept} is important.,The concept of fern is important.
fern,2,{concept} represents a fundamental idea.,fern represents a fundamental idea.
fern,3,Understanding {concept} requires careful thought.,Understanding fern requires careful thought.
fern,4,Many people think about {concept} differently.,Many people think about fern differently.
fern,5,The meaning of {concept} can vary across cultures.,The meaning of fern can vary across cultures.
oak,0,This is about {concept}.,This is about oak.
oak,1,The concept of {concept} is important.,The concept of oak is important.
oak,2,{concept} represents a fundamental idea.,oak represents a fundamental idea.
oak,3,Understanding {concept} requires careful thought.,Understanding oak requires careful thought.
oak,4,Many people think about {concept} differently.,Many people think about oak differently.
oak,5,The meaning of {concept} can vary across cultures.,The meaning of oak can vary across cultures.
pine,0,This is about {concept}.,This is about pine.
pine,1,The concept of {concept} is important.,The concept of pine is important.
pine,2,{concept} represents a fundamental idea.,pine represents a fundamental idea.
pine,3,Understanding {concept} requires careful thought.,Understanding pine requires careful thought.
pine,4,Many people think about {concept} differently.,Many people think about pine differently.
pine,5,The meaning of {concept} can vary across cultures.,The meaning of pine can vary across cultures.
maple,0,This is about {concept}.,This is about maple.
maple,1,The concept of {concept} is important.,The concept of maple is important.
maple,2,{concept} represents a fundamental idea.,maple represents a fundamental idea.
maple,3,Understanding {concept} requires careful thought.,Understanding maple requires careful thought.
maple,4,Many people think about {concept} differently.,Many people think about maple differently.
maple,5,The meaning of {concept} can vary across cultures.,The meaning of maple can vary across cultures.
willow,0,This is about {concept}.,This is about willow.
willow,1,The concept of {concept} is important.,The concept of willow is important.
willow,2,{concept} represents a fundamental idea.,willow represents a fundamental idea.
willow,3,Understanding {concept} requires careful thought.,Understanding willow requires careful thought.
willow,4,Many people think about {concept} differently.,Many people think about willow differently.
willow,5,The meaning of {concept} can vary across cultures.,The meaning of willow can vary across cultures.
bamboo,0,This is about {concept}.,This is about bamboo.
bamboo,1,The concept of {concept} is important.,The concept of bamboo is important.
bamboo,2,{concept} represents a fundamental idea.,bamboo represents a fundamental idea.
bamboo,3,Understanding {concept} requires careful thought.,Understanding bamboo requires careful thought.
bamboo,4,Many people think about {concept} differently.,Many people think about bamboo differently.
bamboo,5,The meaning of {concept} can vary across cultures.,The meaning of bamboo can vary across cultures.
moss,0,This is about {concept}.,This is about moss.
moss,1,The concept of {concept} is important.,The concept of moss is important.
moss,2,{concept} represents a fundamental idea.,moss represents a fundamental idea.
moss,3,Understanding {concept} requires careful thought.,Understanding moss requires careful thought.
moss,4,Many people think about {concept} differently.,Many people think about moss differently.
moss,5,The meaning of {concept} can vary across cultures.,The meaning of moss can vary across cultures.
ivy,0,This is about {concept}.,This is about ivy.
ivy,1,The concept of {concept} is important.,The concept of ivy is important.
ivy,2,{concept} represents a fundamental idea.,ivy represents a fundamental idea.
ivy,3,Understanding {concept} requires careful thought.,Understanding ivy requires careful thought.
ivy,4,Many people think about {concept} differently.,Many people think about ivy differently.
ivy,5,The meaning of {concept} can vary across cultures.,The meaning of ivy can vary across cultures.
vine,0,This is about {concept}.,This is about vine.
vine,1,The concept of {concept} is important.,The concept of vine is important.
vine,2,{concept} represents a fundamental idea.,vine represents a fundamental idea.
vine,3,Understanding {concept} requires careful thought.,Understanding vine requires careful thought.
vine,4,Many people think about {concept} differently.,Many people think about vine differently.
vine,5,The meaning of {concept} can vary across cultures.,The meaning of vine can vary across cultures.
apple,0,This is about {concept}.,This is about apple.
apple,1,The concept of {concept} is important.,The concept of apple is important.
apple,2,{concept} represents a fundamental idea.,apple represents a fundamental idea.
apple,3,Understanding {concept} requires careful thought.,Understanding apple requires careful thought.
apple,4,Many people think about {concept} differently.,Many people think about apple differently.
apple,5,The meaning of {concept} can vary across cultures.,The meaning of apple can vary across cultures.
banana,0,This is about {concept}.,This is about banana.
banana,1,The concept of {concept} is important.,The concept of banana is important.
banana,2,{concept} represents a fundamental idea.,banana represents a fundamental idea.
banana,3,Understanding {concept} requires careful thought.,Understanding banana requires careful thought.
banana,4,Many people think about {concept} differently.,Many people think about banana differently.
banana,5,The meaning of {concept} can vary across cultures.,The meaning of banana can vary across cultures.
orange,0,This is about {concept}.,This is about orange.
orange,1,The concept of {concept} is important.,The concept of orange is important.
orange,2,{concept} represents a fundamental idea.,orange represents a fundamental idea.
orange,3,Understanding {concept} requires careful thought.,Understanding orange requires careful thought.
orange,4,Many people think about {concept} differently.,Many people think about orange differently.
orange,5,The meaning of {concept} can vary across cultures.,The meaning of orange can vary across cultures.
grape,0,This is about {concept}.,This is about grape.
grape,1,The concept of {concept} is important.,The concept of grape is important.
grape,2,{concept} represents a fundamental idea.,grape represents a fundamental idea.
grape,3,Understanding {concept} requires careful thought.,Understanding grape requires careful thought.
grape,4,Many people think about {concept} differently.,Many people think about grape differently.
grape,5,The meaning of {concept} can vary across cultures.,The meaning of grape can vary across cultures.
strawberry,0,This is about {concept}.,This is about strawberry.
strawberry,1,The concept of {concept} is important.,The concept of strawberry is important.
strawberry,2,{concept} represents a fundamental idea.,strawberry represents a fundamental idea.
strawberry,3,Understanding {concept} requires careful thought.,Understanding strawberry requires careful thought.
strawberry,4,Many people think about {concept} differently.,Many people think about strawberry differently.
strawberry,5,The meaning of {concept} can vary across cultures.,The meaning of strawberry can vary across cultures.
watermelon,0,This is about {concept}.,This is about watermelon.
watermelon,1,The concept of {concept} is important.,The concept of watermelon is important.
watermelon,2,{concept} represents a fundamental idea.,watermelon represents a fundamental idea.
watermelon,3,Understanding {concept} requires careful thought.,Understanding watermelon requires careful thought.
watermelon,4,Many people think about {concept} differently.,Many people think about watermelon differently.
watermelon,5,The meaning of {concept} can vary across cultures.,The meaning of watermelon can vary across cultures.
bread,0,This is about {concept}.,This is about bread.
bread,1,The concept of {concept} is important.,The concept of bread is important.
bread,2,{concept} represents a fundamental idea.,bread represents a fundamental idea.
bread,3,Understanding {concept} requires careful thought.,Understanding bread requires careful thought.
bread,4,Many people think about {concept} differently.,Many people think about bread differently.
bread,5,The meaning of {concept} can vary across cultures.,The meaning of bread can vary across cultures.
rice,0,This is about {concept}.,This is about rice.
rice,1,The concept of {concept} is important.,The concept of rice is important.
rice,2,{concept} represents a fundamental idea.,rice represents a fundamental idea.
rice,3,Understanding {concept} requires careful thought.,Understanding rice requires careful thought.
rice,4,Many people think about {concept} differently.,Many people think about rice differently.
rice,5,The meaning of {concept} can vary across cultures.,The meaning of rice can vary across cultures.
meat,0,This is about {concept}.,This is about meat.
meat,1,The concept of {concept} is important.,The concept of meat is important.
meat,2,{concept} represents a fundamental idea.,meat represents a fundamental idea.
meat,3,Understanding {concept} requires careful thought.,Understanding meat requires careful thought.
meat,4,Many people think about {concept} differently.,Many people think about meat differently.
meat,5,The meaning of {concept} can vary across cultures.,The meaning of meat can vary across cultures.
fish,0,This is about {concept}.,This is about fish.
fish,1,The concept of {concept} is important.,The concept of fish is important.
fish,2,{concept} represents a fundamental idea.,fish represents a fundamental idea.
fish,3,Understanding {concept} requires careful thought.,Understanding fish requires careful thought.
fish,4,Many people think about {concept} differently.,Many people think about fish differently.
fish,5,The meaning of {concept} can vary across cultures.,The meaning of fish can vary across cultures.
vegetable,0,This is about {concept}.,This is about vegetable.
vegetable,1,The concept of {concept} is important.,The concept of vegetable is important.
vegetable,2,{concept} represents a fundamental idea.,vegetable represents a fundamental idea.
vegetable,3,Understanding {concept} requires careful thought.,Understanding vegetable requires careful thought.
vegetable,4,Many people think about {concept} differently.,Many people think about vegetable differently.
vegetable,5,The meaning of {concept} can vary across cultures.,The meaning of vegetable can vary across cultures.
fruit,0,This is about {concept}.,This is about fruit.
fruit,1,The concept of {concept} is important.,The concept of fruit is important.
fruit,2,{concept} represents a fundamental idea.,fruit represents a fundamental idea.
fruit,3,Understanding {concept} requires careful thought.,Understanding fruit requires careful thought.
fruit,4,Many people think about {concept} differently.,Many people think about fruit differently.
fruit,5,The meaning of {concept} can vary across cultures.,The meaning of fruit can vary across cultures.
cheese,0,This is about {concept}.,This is about cheese.
cheese,1,The concept of {concept} is important.,The concept of cheese is important.
cheese,2,{concept} represents a fundamental idea.,cheese represents a fundamental idea.
cheese,3,Understanding {concept} requires careful thought.,Understanding cheese requires careful thought.
cheese,4,Many people think about {concept} differently.,Many people think about cheese differently.
cheese,5,The meaning of {concept} can vary across cultures.,The meaning of cheese can vary across cultures.
milk,0,This is about {concept}.,This is about milk.
milk,1,The concept of {concept} is important.,The concept of milk is important.
milk,2,{concept} represents a fundamental idea.,milk represents a fundamental idea.
milk,3,Understanding {concept} requires careful thought.,Understanding milk requires careful thought.
milk,4,Many people think about {concept} differently.,Many people think about milk differently.
milk,5,The meaning of {concept} can vary across cultures.,The meaning of milk can vary across cultures.
egg,0,This is about {concept}.,This is about egg.
egg,1,The concept of {concept} is important.,The concept of egg is important.
egg,2,{concept} represents a fundamental idea.,egg represents a fundamental idea.
egg,3,Understanding {concept} requires careful thought.,Understanding egg requires careful thought.
egg,4,Many people think about {concept} differently.,Many people think about egg differently.
egg,5,The meaning of {concept} can vary across cultures.,The meaning of egg can vary across cultures.
sugar,0,This is about {concept}.,This is about sugar.
sugar,1,The concept of {concept} is important.,The concept of sugar is important.
sugar,2,{concept} represents a fundamental idea.,sugar represents a fundamental idea.
sugar,3,Understanding {concept} requires careful thought.,Understanding sugar requires careful thought.
sugar,4,Many people think about {concept} differently.,Many people think about sugar differently.
sugar,5,The meaning of {concept} can vary across cultures.,The meaning of sugar can vary across cultures.
red,0,This is about {concept}.,This is about red.
red,1,The concept of {concept} is important.,The concept of red is important.
red,2,{concept} represents a fundamental idea.,red represents a fundamental idea.
red,3,Understanding {concept} requires careful thought.,Understanding red requires careful thought.
red,4,Many people think about {concept} differently.,Many people think about red differently.
red,5,The meaning of {concept} can vary across cultures.,The meaning of red can vary across cultures.
